{
  "$schema": "http://json-schema.org/draft-07/schema#",
  "$id": "potato",
  "title": "An identifiable Potato object",
  "description": "",

  "definitions": {
    "id": { "type": "string" },

    "evident": {
      "type": "object",
      "additionalProperties": false,
      "required": ["mass", "volume", "introduced"],
      "properties": {
        "mass": { "type": "number" },
        "volume": { "type": "number" },
        "introduced": {
          "type": "object",
          "additionalProperties": false,
          "required": ["where", "when"],
          "properties": {
            "where": { "type": "number" },
            "when": { "type": "number" }
          }
        },
        "3d": {
          "type": "object",
          "additionalProperties": false,
          "required": ["image", "heightmap"],
          "properties": {
            "image": { "type": "string" },
            "heightmap": { "type": "string" }
          }
        }
      }
    },

    "emergent": {
      "type": "object",
      "additionalProperties": false,
      "required": ["density", "variety", "size", "grade"],
      "properties": {
        "density": { "type": "number" },
        "variety": { "type": "string", "enum": ["red", "white", "yellow", "russet", "fingerling", "queen_anne", "sweet"] },
        "color": { "type": "string" },
        "size": { "type": "string", "enum": ["chef", "A", "B", "creamer", "small", "medium", "large"] },
        "grade": { "type": "string", "enum": ["1", "C", "2", "3"] }
      }
    }

  },

  "type": "object",
  "additionalProperties": false,
  "required": ["id", "evident", "emergent", "history"],
  "properties": {
    "id": { "$ref": "#/definitions/id" },
    "evident": { "$ref": "#/definitions/evident" },
    "emergent": { "$ref": "#/definitions/emergent" },

    "history": {
      "type": "array",
      "items": {
        "type": "object",
        "required": ["id", "evident", "emergent"],
        "additionalProperties": false,
        "properties": {
          "id": { "$ref": "#/definitions/id" },
          "evident": { "$ref": "#/definitions/evident" },
          "emergent": { "$ref": "#/definitions/emergent" }
        }
      }
    }
  }
}
